{
  "id": "fix_flow_nucleus",
  "act": "FixFlowNucleus",
  "module": "realizers.py.core",
  "callable": "realize_fix_flow_nucleus",
  "input_kind": "StabilizedObservation",
  "output_kind": "FixedInvariant",
  "description": "Extract FixedInvariant by enforcing aperiodic Flow–Nucleus commutation."
}
